root@lamp-ubuntu-s-1vcpu-1gb-tor1-01:~# tcpdump -i eth0
tcpdump: verbose output suppressed, use -v or -vv for full protocol decode
listening on eth0, link-type EN10MB (Ethernet), capture size 262144 bytes

02:06:50.916265 IP lamp-ubuntu-s-1vcpu-1gb-tor1-01.ssh > bras-base-toroon0817w-grc-26-184-146-121-215.dsl.bell.ca.64650: Flags [P.], seq 163480:163700, ack 109, win 501, length 220
02:06:50.916327 IP lamp-ubuntu-s-1vcpu-1gb-tor1-01.ssh > bras-base-toroon0817w-grc-26-184-146-121-215.dsl.bell.ca.64650: Flags [P.], seq 163700:163920, ack 109, win 501, length 220
02:06:50.916389 IP lamp-ubuntu-s-1vcpu-1gb-tor1-01.ssh > bras-base-toroon0817w-grc-26-184-146-121-215.dsl.bell.ca.64650: Flags [P.], seq 163920:164140, ack 109, win 501, length 220
02:06:50.916451 IP lamp-ubuntu-s-1vcpu-1gb-tor1-01.ssh > bras-base-toroon0817w-grc-26-184-146-121-215.dsl.bell.ca.64650: Flags [P.], seq 164140:164360, ack 109, win 501, length 220
02:06:50.916461 IP bras-base-toroon0817w-grc-26-184-146-121-215.dsl.bell.ca.64650 > lamp-ubuntu-s-1vcpu-1gb-tor1-01.ssh: Flags [.], ack 157840, win 1026, length 0
02:06:50.916509 IP lamp-ubuntu-s-1vcpu-1gb-tor1-01.ssh > bras-base-toroon0817w-grc-26-184-146-121-215.dsl.bell.ca.64650: Flags [P.], seq 164360:164740, ack 109, win 501, length 380
02:06:50.916560 IP lamp-ubuntu-s-1vcpu-1gb-tor1-01.ssh > bras-base-toroon0817w-grc-26-184-146-121-215.dsl.bell.ca.64650: Flags [P.], seq 164740:164960, ack 109, win 501, length 220
02:06:50.916611 IP lamp-ubuntu-s-1vcpu-1gb-tor1-01.ssh > bras-base-toroon0817w-grc-26-184-146-121-215.dsl.bell.ca.64650: Flags [P.], seq 164960:165180, ack 109, win 501, length 220
02:06:50.916662 IP lamp-ubuntu-s-1vcpu-1gb-tor1-01.ssh > bras-base-toroon0817w-grc-26-184-146-121-215.dsl.bell.ca.64650: Flags [P.], seq 165180:165400, ack 109, win 501, length 220
02:06:50.916714 IP lamp-ubuntu-s-1vcpu-1gb-tor1-01.ssh > bras-base-toroon0817w-grc-26-184-146-121-215.dsl.bell.ca.64650: Flags [P.], seq 165400:165620, ack 109, win 501, length 220
02:06:50.916765 IP lamp-ubuntu-s-1vcpu-1gb-tor1-01.ssh > bras-base-toroon0817w-grc-26-184-146-121-215.dsl.bell.ca.64650: Flags [P.], seq 165620:165840, ack 109, win 501, length 220
02:06:50.916853 IP lamp-ubuntu-s-1vcpu-1gb-tor1-01.ssh > bras-base-toroon0817w-grc-26-184-146-121-215.dsl.bell.ca.64650: Flags [P.], seq 165840:166096, ack 109, win 501, length 256
02:06:50.916879 IP bras-base-toroon0817w-grc-26-184-146-121-215.dsl.bell.ca.64650 > lamp-ubuntu-s-1vcpu-1gb-tor1-01.ssh: Flags [.], ack 159540, win 1026, length 0
02:06:50.916921 IP lamp-ubuntu-s-1vcpu-1gb-tor1-01.ssh > bras-base-toroon0817w-grc-26-184-146-121-215.dsl.bell.ca.64650: Flags [P.], seq 166096:166316, ack 109, win 501, length 220
02:06:50.916977 IP lamp-ubuntu-s-1vcpu-1gb-tor1-01.ssh > bras-base-toroon0817w-grc-26-184-146-121-215.dsl.bell.ca.64650: Flags [P.], seq 166316:166520, ack 109, win 501, length 204
02:06:50.916995 IP lamp-ubuntu-s-1vcpu-1gb-tor1-01.ssh > bras-base-toroon0817w-grc-26-184-146-121-215.dsl.bell.ca.64650: Flags [P.], seq 166520:166740, ack 109, win 501, length 220
02:06:50.917045 IP lamp-ubuntu-s-1vcpu-1gb-tor1-01.ssh > bras-base-toroon0817w-grc-26-184-146-121-215.dsl.bell.ca.64650: Flags [P.], seq 166740:167144, ack 109, win 501, length 404
02:06:50.917106 IP lamp-ubuntu-s-1vcpu-1gb-tor1-01.ssh > bras-base-toroon0817w-grc-26-184-146-121-215.dsl.bell.ca.64650: Flags [P.], seq 167144:167364, ack 109, win 501, length 220
02:06:50.917174 IP lamp-ubuntu-s-1vcpu-1gb-tor1-01.ssh > bras-base-toroon0817w-grc-26-184-146-121-215.dsl.bell.ca.64650: Flags [P.], seq 167364:167584, ack 109, win 501, length 220
02:06:50.917236 IP lamp-ubuntu-s-1vcpu-1gb-tor1-01.ssh > bras-base-toroon0817w-grc-26-184-146-121-215.dsl.bell.ca.64650: Flags [P.], seq 167584:167804, ack 109, win 501, length 220
02:06:50.917250 IP bras-base-toroon0817w-grc-26-184-146-121-215.dsl.bell.ca.64650 > lamp-ubuntu-s-1vcpu-1gb-tor1-01.ssh: Flags [.], ack 161180, win 1026, length 0
02:06:50.917301 IP lamp-ubuntu-s-1vcpu-1gb-tor1-01.ssh > bras-base-toroon0817w-grc-26-184-146-121-215.dsl.bell.ca.64650: Flags [P.], seq 167804:168184, ack 109, win 501, length 380
02:06:50.917353 IP lamp-ubuntu-s-1vcpu-1gb-tor1-01.ssh > bras-base-toroon0817w-grc-26-184-146-121-215.dsl.bell.ca.64650: Flags [P.], seq 168184:168404, ack 109, win 501, length 220
02:06:50.917405 IP lamp-ubuntu-s-1vcpu-1gb-tor1-01.ssh > bras-base-toroon0817w-grc-26-184-146-121-215.dsl.bell.ca.64650: Flags [P.], seq 168404:168624, ack 109, win 501, length 220
02:06:50.917456 IP lamp-ubuntu-s-1vcpu-1gb-tor1-01.ssh > bras-base-toroon0817w-grc-26-184-146-121-215.dsl.bell.ca.64650: Flags [P.], seq 168624:168844, ack 109, win 501, length 220
02:06:50.917506 IP lamp-ubuntu-s-1vcpu-1gb-tor1-01.ssh > bras-base-toroon0817w-grc-26-184-146-121-215.dsl.bell.ca.64650: Flags [P.], seq 168844:169064, ack 109, win 501, length 220
02:06:50.917557 IP lamp-ubuntu-s-1vcpu-1gb-tor1-01.ssh > bras-base-toroon0817w-grc-26-184-146-121-215.dsl.bell.ca.64650: Flags [P.], seq 169064:169284, ack 109, win 501, length 220
02:06:50.917608 IP lamp-ubuntu-s-1vcpu-1gb-tor1-01.ssh > bras-base-toroon0817w-grc-26-184-146-121-215.dsl.bell.ca.64650: Flags [P.], seq 169284:169504, ack 109, win 501, length 220
02:06:50.917619 IP bras-base-toroon0817w-grc-26-184-146-121-215.dsl.bell.ca.64650 > lamp-ubuntu-s-1vcpu-1gb-tor1-01.ssh: Flags [.], ack 162280, win 1022, length 0
02:06:50.917658 IP lamp-ubuntu-s-1vcpu-1gb-tor1-01.ssh > bras-base-toroon0817w-grc-26-184-146-121-215.dsl.bell.ca.64650: Flags [P.], seq 169504:169540, ack 109, win 501, length 36
02:06:50.917705 IP lamp-ubuntu-s-1vcpu-1gb-tor1-01.ssh > bras-base-toroon0817w-grc-26-184-146-121-215.dsl.bell.ca.64650: Flags [P.], seq 169540:170104, ack 109, win 501, length 564
02:06:50.917723 IP bras-base-toroon0817w-grc-26-184-146-121-215.dsl.bell.ca.64650 > lamp-ubuntu-s-1vcpu-1gb-tor1-01.ssh: Flags [.], ack 163480, win 1026, length 0
02:06:50.917792 IP lamp-ubuntu-s-1vcpu-1gb-tor1-01.ssh > bras-base-toroon0817w-grc-26-184-146-121-215.dsl.bell.ca.64650: Flags [P.], seq 170104:170484, ack 109, win 501, length 380
02:06:50.917847 IP lamp-ubuntu-s-1vcpu-1gb-tor1-01.ssh > bras-base-toroon0817w-grc-26-184-146-121-215.dsl.bell.ca.64650: Flags [P.], seq 170484:170704, ack 109, win 501, length 220
02:06:50.917910 IP lamp-ubuntu-s-1vcpu-1gb-tor1-01.ssh > bras-base-toroon0817w-grc-26-184-146-121-215.dsl.bell.ca.64650: Flags [P.], seq 170704:170924, ack 109, win 501, length 220
02:06:50.917968 IP lamp-ubuntu-s-1vcpu-1gb-tor1-01.ssh > bras-base-toroon0817w-grc-26-184-146-121-215.dsl.bell.ca.64650: Flags [P.], seq 170924:171144, ack 109, win 501, length 220
02:06:50.918028 IP lamp-ubuntu-s-1vcpu-1gb-tor1-01.ssh > bras-base-toroon0817w-grc-26-184-146-121-215.dsl.bell.ca.64650: Flags [P.], seq 171144:171364, ack 109, win 501, length 220
02:06:50.918079 IP lamp-ubuntu-s-1vcpu-1gb-tor1-01.ssh > bras-base-toroon0817w-grc-26-184-146-121-215.dsl.bell.ca.64650: Flags [P.], seq 171364:171584, ack 109, win 501, length 220
02:06:50.918130 IP lamp-ubuntu-s-1vcpu-1gb-tor1-01.ssh > bras-base-toroon0817w-grc-26-184-146-121-215.dsl.bell.ca.64650: Flags [P.], seq 171584:171804, ack 109, win 501, length 220
02:06:50.918142 IP bras-base-toroon0817w-grc-26-184-146-121-215.dsl.bell.ca.64650 > lamp-ubuntu-s-1vcpu-1gb-tor1-01.ssh: Flags [.], ack 164960, win 1026, length 0
02:06:50.918193 IP lamp-ubuntu-s-1vcpu-1gb-tor1-01.ssh > bras-base-toroon0817w-grc-26-184-146-121-215.dsl.bell.ca.64650: Flags [P.], seq 171804:172184, ack 109, win 501, length 380
02:06:50.918261 IP lamp-ubuntu-s-1vcpu-1gb-tor1-01.ssh > bras-base-toroon0817w-grc-26-184-146-121-215.dsl.bell.ca.64650: Flags [P.], seq 172184:172404, ack 109, win 501, length 220
02:06:50.918366 IP lamp-ubuntu-s-1vcpu-1gb-tor1-01.ssh > bras-base-toroon0817w-grc-26-184-146-121-215.dsl.bell.ca.64650: Flags [P.], seq 172404:172624, ack 109, win 501, length 220
02:06:50.918375 IP bras-base-toroon0817w-grc-26-184-146-121-215.dsl.bell.ca.64650 > lamp-ubuntu-s-1vcpu-1gb-tor1-01.ssh: Flags [.], ack 165840, win 1023, length 0
02:06:50.918424 IP lamp-ubuntu-s-1vcpu-1gb-tor1-01.ssh > bras-base-toroon0817w-grc-26-184-146-121-215.dsl.bell.ca.64650: Flags [P.], seq 172624:173004, ack 109, win 501, length 380
02:06:50.918485 IP lamp-ubuntu-s-1vcpu-1gb-tor1-01.ssh > bras-base-toroon0817w-grc-26-184-146-121-215.dsl.bell.ca.64650: Flags [P.], seq 173004:173224, ack 109, win 501, length 220
02:06:50.918550 IP lamp-ubuntu-s-1vcpu-1gb-tor1-01.ssh > bras-base-toroon0817w-grc-26-184-146-121-215.dsl.bell.ca.64650: Flags [P.], seq 173224:173444, ack 109, win 501, length 220
02:06:50.918609 IP lamp-ubuntu-s-1vcpu-1gb-tor1-01.ssh > bras-base-toroon0817w-grc-26-184-146-121-215.dsl.bell.ca.64650: Flags [P.], seq 173444:173664, ack 109, win 501, length 220
02:06:50.918670 IP lamp-ubuntu-s-1vcpu-1gb-tor1-01.ssh > bras-base-toroon0817w-grc-26-184-146-121-215.dsl.bell.ca.64650: Flags [P.], seq 173664:173884, ack 109, win 501, length 220
02:06:50.918732 IP lamp-ubuntu-s-1vcpu-1gb-tor1-01.ssh > bras-base-toroon0817w-grc-26-184-146-121-215.dsl.bell.ca.64650: Flags [P.], seq 173884:174104, ack 109, win 501, length 220
02:06:50.918743 IP bras-base-toroon0817w-grc-26-184-146-121-215.dsl.bell.ca.64650 > lamp-ubuntu-s-1vcpu-1gb-tor1-01.ssh: Flags [.], ack 167364, win 1026, length 0
02:06:50.918793 IP lamp-ubuntu-s-1vcpu-1gb-tor1-01.ssh > bras-base-toroon0817w-grc-26-184-146-121-215.dsl.bell.ca.64650: Flags [P.], seq 174104:174484, ack 109, win 501, length 380
02:06:50.918856 IP lamp-ubuntu-s-1vcpu-1gb-tor1-01.ssh > bras-base-toroon0817w-grc-26-184-146-121-215.dsl.bell.ca.64650: Flags [P.], seq 174484:174704, ack 109, win 501, length 220
02:06:50.918920 IP lamp-ubuntu-s-1vcpu-1gb-tor1-01.ssh > bras-base-toroon0817w-grc-26-184-146-121-215.dsl.bell.ca.64650: Flags [P.], seq 174704:174924, ack 109, win 501, length 220
02:06:50.918984 IP lamp-ubuntu-s-1vcpu-1gb-tor1-01.ssh > bras-base-toroon0817w-grc-26-184-146-121-215.dsl.bell.ca.64650: Flags [P.], seq 174924:175144, ack 109, win 501, length 220
02:06:50.918996 IP bras-base-toroon0817w-grc-26-184-146-121-215.dsl.bell.ca.64650 > lamp-ubuntu-s-1vcpu-1gb-tor1-01.ssh: Flags [.], ack 168624, win 1021, length 0
02:06:50.919048 IP lamp-ubuntu-s-1vcpu-1gb-tor1-01.ssh > bras-base-toroon0817w-grc-26-184-146-121-215.dsl.bell.ca.64650: Flags [P.], seq 175144:175524, ack 109, win 501, length 380
02:06:50.919109 IP lamp-ubuntu-s-1vcpu-1gb-tor1-01.ssh > bras-base-toroon0817w-grc-26-184-146-121-215.dsl.bell.ca.64650: Flags [P.], seq 175524:175744, ack 109, win 501, length 220
02:06:50.919169 IP lamp-ubuntu-s-1vcpu-1gb-tor1-01.ssh > bras-base-toroon0817w-grc-26-184-146-121-215.dsl.bell.ca.64650: Flags [P.], seq 175744:175964, ack 109, win 501, length 220
02:06:50.919231 IP lamp-ubuntu-s-1vcpu-1gb-tor1-01.ssh > bras-base-toroon0817w-grc-26-184-146-121-215.dsl.bell.ca.64650: Flags [P.], seq 175964:176184, ack 109, win 501, length 220
02:06:50.919242 IP bras-base-toroon0817w-grc-26-184-146-121-215.dsl.bell.ca.64650 > lamp-ubuntu-s-1vcpu-1gb-tor1-01.ssh: Flags [.], ack 169540, win 1026, length 0
02:06:50.919290 IP lamp-ubuntu-s-1vcpu-1gb-tor1-01.ssh > bras-base-toroon0817w-grc-26-184-146-121-215.dsl.bell.ca.64650: Flags [P.], seq 176184:176564, ack 109, win 501, length 380
02:06:50.919352 IP lamp-ubuntu-s-1vcpu-1gb-tor1-01.ssh > bras-base-toroon0817w-grc-26-184-146-121-215.dsl.bell.ca.64650: Flags [P.], seq 176564:176784, ack 109, win 501, length 220
02:06:50.919363 IP bras-base-toroon0817w-grc-26-184-146-121-215.dsl.bell.ca.64650 > lamp-ubuntu-s-1vcpu-1gb-tor1-01.ssh: Flags [.], ack 170924, win 1021, length 0
02:06:50.919412 IP lamp-ubuntu-s-1vcpu-1gb-tor1-01.ssh > bras-base-toroon0817w-grc-26-184-146-121-215.dsl.bell.ca.64650: Flags [P.], seq 176784:177164, ack 109, win 501, length 380
02:06:50.919474 IP lamp-ubuntu-s-1vcpu-1gb-tor1-01.ssh > bras-base-toroon0817w-grc-26-184-146-121-215.dsl.bell.ca.64650: Flags [P.], seq 177164:177384, ack 109, win 501, length 220
02:06:50.919534 IP lamp-ubuntu-s-1vcpu-1gb-tor1-01.ssh > bras-base-toroon0817w-grc-26-184-146-121-215.dsl.bell.ca.64650: Flags [P.], seq 177384:177604, ack 109, win 501, length 220
02:06:50.919593 IP lamp-ubuntu-s-1vcpu-1gb-tor1-01.ssh > bras-base-toroon0817w-grc-26-184-146-121-215.dsl.bell.ca.64650: Flags [P.], seq 177604:177824, ack 109, win 501, length 220
02:06:50.919653 IP lamp-ubuntu-s-1vcpu-1gb-tor1-01.ssh > bras-base-toroon0817w-grc-26-184-146-121-215.dsl.bell.ca.64650: Flags [P.], seq 177824:178044, ack 109, win 501, length 220
02:06:50.919714 IP lamp-ubuntu-s-1vcpu-1gb-tor1-01.ssh > bras-base-toroon0817w-grc-26-184-146-121-215.dsl.bell.ca.64650: Flags [P.], seq 178044:178264, ack 109, win 501, length 220
02:06:50.919724 IP bras-base-toroon0817w-grc-26-184-146-121-215.dsl.bell.ca.64650 > lamp-ubuntu-s-1vcpu-1gb-tor1-01.ssh: Flags [.], ack 171804, win 1026, length 0
02:06:50.919773 IP lamp-ubuntu-s-1vcpu-1gb-tor1-01.ssh > bras-base-toroon0817w-grc-26-184-146-121-215.dsl.bell.ca.64650: Flags [P.], seq 178264:178644, ack 109, win 501, length 380
02:06:50.919833 IP lamp-ubuntu-s-1vcpu-1gb-tor1-01.ssh > bras-base-toroon0817w-grc-26-184-146-121-215.dsl.bell.ca.64650: Flags [P.], seq 178644:178864, ack 109, win 501, length 220
02:06:50.919893 IP lamp-ubuntu-s-1vcpu-1gb-tor1-01.ssh > bras-base-toroon0817w-grc-26-184-146-121-215.dsl.bell.ca.64650: Flags [P.], seq 178864:179084, ack 109, win 501, length 220
02:06:50.919953 IP lamp-ubuntu-s-1vcpu-1gb-tor1-01.ssh > bras-base-toroon0817w-grc-26-184-146-121-215.dsl.bell.ca.64650: Flags [P.], seq 179084:179304, ack 109, win 501, length 220
02:06:50.919964 IP bras-base-toroon0817w-grc-26-184-146-121-215.dsl.bell.ca.64650 > lamp-ubuntu-s-1vcpu-1gb-tor1-01.ssh: Flags [.], ack 172624, win 1023, length 0
02:06:50.920011 IP lamp-ubuntu-s-1vcpu-1gb-tor1-01.ssh > bras-base-toroon0817w-grc-26-184-146-121-215.dsl.bell.ca.64650: Flags [P.], seq 179304:179684, ack 109, win 501, length 380
02:06:50.920072 IP lamp-ubuntu-s-1vcpu-1gb-tor1-01.ssh > bras-base-toroon0817w-grc-26-184-146-121-215.dsl.bell.ca.64650: Flags [P.], seq 179684:179904, ack 109, win 501, length 220
02:06:50.920132 IP lamp-ubuntu-s-1vcpu-1gb-tor1-01.ssh > bras-base-toroon0817w-grc-26-184-146-121-215.dsl.bell.ca.64650: Flags [P.], seq 179904:180124, ack 109, win 501, length 220
02:06:50.920193 IP lamp-ubuntu-s-1vcpu-1gb-tor1-01.ssh > bras-base-toroon0817w-grc-26-184-146-121-215.dsl.bell.ca.64650: Flags [P.], seq 180124:180344, ack 109, win 501, length 220
02:06:50.920203 IP bras-base-toroon0817w-grc-26-184-146-121-215.dsl.bell.ca.64650 > lamp-ubuntu-s-1vcpu-1gb-tor1-01.ssh: Flags [.], ack 173884, win 1026, length 0
02:06:50.920250 IP lamp-ubuntu-s-1vcpu-1gb-tor1-01.ssh > bras-base-toroon0817w-grc-26-184-146-121-215.dsl.bell.ca.64650: Flags [P.], seq 180344:180724, ack 109, win 501, length 380
02:06:50.920312 IP lamp-ubuntu-s-1vcpu-1gb-tor1-01.ssh > bras-base-toroon0817w-grc-26-184-146-121-215.dsl.bell.ca.64650: Flags [P.], seq 180724:180944, ack 109, win 501, length 220
02:06:50.920373 IP lamp-ubuntu-s-1vcpu-1gb-tor1-01.ssh > bras-base-toroon0817w-grc-26-184-146-121-215.dsl.bell.ca.64650: Flags [P.], seq 180944:181164, ack 109, win 501, length 220
02:06:50.920433 IP lamp-ubuntu-s-1vcpu-1gb-tor1-01.ssh > bras-base-toroon0817w-grc-26-184-146-121-215.dsl.bell.ca.64650: Flags [P.], seq 181164:181384, ack 109, win 501, length 220
02:06:50.920494 IP lamp-ubuntu-s-1vcpu-1gb-tor1-01.ssh > bras-base-toroon0817w-grc-26-184-146-121-215.dsl.bell.ca.64650: Flags [P.], seq 181384:181604, ack 109, win 501, length 220
02:06:50.920505 IP bras-base-toroon0817w-grc-26-184-146-121-215.dsl.bell.ca.64650 > lamp-ubuntu-s-1vcpu-1gb-tor1-01.ssh: Flags [.], ack 174924, win 1022, length 0
02:06:50.920553 IP lamp-ubuntu-s-1vcpu-1gb-tor1-01.ssh > bras-base-toroon0817w-grc-26-184-146-121-215.dsl.bell.ca.64650: Flags [P.], seq 181604:181984, ack 109, win 501, length 380
02:06:50.920614 IP lamp-ubuntu-s-1vcpu-1gb-tor1-01.ssh > bras-base-toroon0817w-grc-26-184-146-121-215.dsl.bell.ca.64650: Flags [P.], seq 181984:182204, ack 109, win 501, length 220
02:06:50.920703 IP bras-base-toroon0817w-grc-26-184-146-121-215.dsl.bell.ca.64650 > lamp-ubuntu-s-1vcpu-1gb-tor1-01.ssh: Flags [.], ack 176184, win 1026, length 0
02:06:50.920712 IP lamp-ubuntu-s-1vcpu-1gb-tor1-01.ssh > bras-base-toroon0817w-grc-26-184-146-121-215.dsl.bell.ca.64650: Flags [P.], seq 182204:182424, ack 109, win 501, length 220
02:06:50.920767 IP lamp-ubuntu-s-1vcpu-1gb-tor1-01.ssh > bras-base-toroon0817w-grc-26-184-146-121-215.dsl.bell.ca.64650: Flags [P.], seq 182424:182804, ack 109, win 501, length 380
02:06:50.920830 IP lamp-ubuntu-s-1vcpu-1gb-tor1-01.ssh > bras-base-toroon0817w-grc-26-184-146-121-215.dsl.bell.ca.64650: Flags [P.], seq 182804:183024, ack 109, win 501, length 220
02:06:50.920889 IP lamp-ubuntu-s-1vcpu-1gb-tor1-01.ssh > bras-base-toroon0817w-grc-26-184-146-121-215.dsl.bell.ca.64650: Flags [P.], seq 183024:183244, ack 109, win 501, length 220
02:06:50.920950 IP lamp-ubuntu-s-1vcpu-1gb-tor1-01.ssh > bras-base-toroon0817w-grc-26-184-146-121-215.dsl.bell.ca.64650: Flags [P.], seq 183244:183464, ack 109, win 501, length 220
02:06:50.921008 IP lamp-ubuntu-s-1vcpu-1gb-tor1-01.ssh > bras-base-toroon0817w-grc-26-184-146-121-215.dsl.bell.ca.64650: Flags [P.], seq 183464:183684, ack 109, win 501, length 220
02:06:50.921068 IP lamp-ubuntu-s-1vcpu-1gb-tor1-01.ssh > bras-base-toroon0817w-grc-26-184-146-121-215.dsl.bell.ca.64650: Flags [P.], seq 183684:183904, ack 109, win 501, length 220
02:06:50.921080 IP bras-base-toroon0817w-grc-26-184-146-121-215.dsl.bell.ca.64650 > lamp-ubuntu-s-1vcpu-1gb-tor1-01.ssh: Flags [.], ack 177604, win 1021, length 0
02:06:50.921128 IP lamp-ubuntu-s-1vcpu-1gb-tor1-01.ssh > bras-base-toroon0817w-grc-26-184-146-121-215.dsl.bell.ca.64650: Flags [P.], seq 183904:184284, ack 109, win 501, length 380
02:06:50.921188 IP lamp-ubuntu-s-1vcpu-1gb-tor1-01.ssh > bras-base-toroon0817w-grc-26-184-146-121-215.dsl.bell.ca.64650: Flags [P.], seq 184284:184504, ack 109, win 501, length 220
02:06:50.921248 IP lamp-ubuntu-s-1vcpu-1gb-tor1-01.ssh > bras-base-toroon0817w-grc-26-184-146-121-215.dsl.bell.ca.64650: Flags [P.], seq 184504:184724, ack 109, win 501, length 220
02:06:50.921307 IP lamp-ubuntu-s-1vcpu-1gb-tor1-01.ssh > bras-base-toroon0817w-grc-26-184-146-121-215.dsl.bell.ca.64650: Flags [P.], seq 184724:184944, ack 109, win 501, length 220
02:06:50.921366 IP lamp-ubuntu-s-1vcpu-1gb-tor1-01.ssh > bras-base-toroon0817w-grc-26-184-146-121-215.dsl.bell.ca.64650: Flags [P.], seq 184944:185164, ack 109, win 501, length 220
02:06:50.921426 IP lamp-ubuntu-s-1vcpu-1gb-tor1-01.ssh > bras-base-toroon0817w-grc-26-184-146-121-215.dsl.bell.ca.64650: Flags [P.], seq 185164:185384, ack 109, win 501, length 220
02:06:50.921486 IP lamp-ubuntu-s-1vcpu-1gb-tor1-01.ssh > bras-base-toroon0817w-grc-26-184-146-121-215.dsl.bell.ca.64650: Flags [P.], seq 185384:185604, ack 109, win 501, length 220
02:06:50.921545 IP lamp-ubuntu-s-1vcpu-1gb-tor1-01.ssh > bras-base-toroon0817w-grc-26-184-146-121-215.dsl.bell.ca.64650: Flags [P.], seq 185604:185824, ack 109, win 501, length 220
02:06:50.921605 IP lamp-ubuntu-s-1vcpu-1gb-tor1-01.ssh > bras-base-toroon0817w-grc-26-184-146-121-215.dsl.bell.ca.64650: Flags [P.], seq 185824:186044, ack 109, win 501, length 220
02:06:50.921619 IP bras-base-toroon0817w-grc-26-184-146-121-215.dsl.bell.ca.64650 > lamp-ubuntu-s-1vcpu-1gb-tor1-01.ssh: Flags [.], ack 179304, win 1026, length 0
02:06:50.921668 IP lamp-ubuntu-s-1vcpu-1gb-tor1-01.ssh > bras-base-toroon0817w-grc-26-184-146-121-215.dsl.bell.ca.64650: Flags [P.], seq 186044:186424, ack 109, win 501, length 380
02:06:50.921727 IP lamp-ubuntu-s-1vcpu-1gb-tor1-01.ssh > bras-base-toroon0817w-grc-26-184-146-121-215.dsl.bell.ca.64650: Flags [P.], seq 186424:186644, ack 109, win 501, length 220
02:06:50.921786 IP lamp-ubuntu-s-1vcpu-1gb-tor1-01.ssh > bras-base-toroon0817w-grc-26-184-146-121-215.dsl.bell.ca.64650: Flags [P.], seq 186644:186864, ack 109, win 501, length 220
02:06:50.921847 IP lamp-ubuntu-s-1vcpu-1gb-tor1-01.ssh > bras-base-toroon0817w-grc-26-184-146-121-215.dsl.bell.ca.64650: Flags [P.], seq 186864:187084, ack 109, win 501, length 220
02:06:50.921860 IP bras-base-toroon0817w-grc-26-184-146-121-215.dsl.bell.ca.64650 > lamp-ubuntu-s-1vcpu-1gb-tor1-01.ssh: Flags [.], ack 180944, win 1026, length 0
02:06:50.921909 IP lamp-ubuntu-s-1vcpu-1gb-tor1-01.ssh > bras-base-toroon0817w-grc-26-184-146-121-215.dsl.bell.ca.64650: Flags [P.], seq 187084:187464, ack 109, win 501, length 380
02:06:50.921973 IP lamp-ubuntu-s-1vcpu-1gb-tor1-01.ssh > bras-base-toroon0817w-grc-26-184-146-121-215.dsl.bell.ca.64650: Flags [P.], seq 187464:187684, ack 109, win 501, length 220
02:06:50.922042 IP lamp-ubuntu-s-1vcpu-1gb-tor1-01.ssh > bras-base-toroon0817w-grc-26-184-146-121-215.dsl.bell.ca.64650: Flags [P.], seq 187684:187904, ack 109, win 501, length 220
02:06:50.922104 IP lamp-ubuntu-s-1vcpu-1gb-tor1-01.ssh > bras-base-toroon0817w-grc-26-184-146-121-215.dsl.bell.ca.64650: Flags [P.], seq 187904:188124, ack 109, win 501, length 220
02:06:50.922163 IP lamp-ubuntu-s-1vcpu-1gb-tor1-01.ssh > bras-base-toroon0817w-grc-26-184-146-121-215.dsl.bell.ca.64650: Flags [P.], seq 188124:188344, ack 109, win 501, length 220
02:06:50.922222 IP lamp-ubuntu-s-1vcpu-1gb-tor1-01.ssh > bras-base-toroon0817w-grc-26-184-146-121-215.dsl.bell.ca.64650: Flags [P.], seq 188344:188564, ack 109, win 501, length 220
02:06:50.922233 IP bras-base-toroon0817w-grc-26-184-146-121-215.dsl.bell.ca.64650 > lamp-ubuntu-s-1vcpu-1gb-tor1-01.ssh: Flags [.], ack 182424, win 1026, length 0
02:06:50.922327 IP lamp-ubuntu-s-1vcpu-1gb-tor1-01.ssh > bras-base-toroon0817w-grc-26-184-146-121-215.dsl.bell.ca.64650: Flags [P.], seq 188564:188944, ack 109, win 501, length 380
02:06:50.922393 IP lamp-ubuntu-s-1vcpu-1gb-tor1-01.ssh > bras-base-toroon0817w-grc-26-184-146-121-215.dsl.bell.ca.64650: Flags [P.], seq 188944:189164, ack 109, win 501, length 220
02:06:50.922455 IP lamp-ubuntu-s-1vcpu-1gb-tor1-01.ssh > bras-base-toroon0817w-grc-26-184-146-121-215.dsl.bell.ca.64650: Flags [P.], seq 189164:189384, ack 109, win 501, length 220
02:06:50.922515 IP lamp-ubuntu-s-1vcpu-1gb-tor1-01.ssh > bras-base-toroon0817w-grc-26-184-146-121-215.dsl.bell.ca.64650: Flags [P.], seq 189384:189604, ack 109, win 501, length 220
02:06:50.922575 IP lamp-ubuntu-s-1vcpu-1gb-tor1-01.ssh > bras-base-toroon0817w-grc-26-184-146-121-215.dsl.bell.ca.64650: Flags [P.], seq 189604:189824, ack 109, win 501, length 220
02:06:50.922638 IP lamp-ubuntu-s-1vcpu-1gb-tor1-01.ssh > bras-base-toroon0817w-grc-26-184-146-121-215.dsl.bell.ca.64650: Flags [P.], seq 189824:190044, ack 109, win 501, length 220
02:06:50.922660 IP bras-base-toroon0817w-grc-26-184-146-121-215.dsl.bell.ca.64650 > lamp-ubuntu-s-1vcpu-1gb-tor1-01.ssh: Flags [.], ack 183684, win 1021, length 0
02:06:50.922728 IP lamp-ubuntu-s-1vcpu-1gb-tor1-01.ssh > bras-base-toroon0817w-grc-26-184-146-121-215.dsl.bell.ca.64650: Flags [P.], seq 190044:190424, ack 109, win 501, length 380
02:06:50.922792 IP lamp-ubuntu-s-1vcpu-1gb-tor1-01.ssh > bras-base-toroon0817w-grc-26-184-146-121-215.dsl.bell.ca.64650: Flags [P.], seq 190424:190644, ack 109, win 501, length 220
02:06:50.922853 IP lamp-ubuntu-s-1vcpu-1gb-tor1-01.ssh > bras-base-toroon0817w-grc-26-184-146-121-215.dsl.bell.ca.64650: Flags [P.], seq 190644:190864, ack 109, win 501, length 220
02:06:50.922914 IP lamp-ubuntu-s-1vcpu-1gb-tor1-01.ssh > bras-base-toroon0817w-grc-26-184-146-121-215.dsl.bell.ca.64650: Flags [P.], seq 190864:191084, ack 109, win 501, length 220
02:06:50.922974 IP lamp-ubuntu-s-1vcpu-1gb-tor1-01.ssh > bras-base-toroon0817w-grc-26-184-146-121-215.dsl.bell.ca.64650: Flags [P.], seq 191084:191304, ack 109, win 501, length 220
02:06:50.922985 IP bras-base-toroon0817w-grc-26-184-146-121-215.dsl.bell.ca.64650 > lamp-ubuntu-s-1vcpu-1gb-tor1-01.ssh: Flags [.], ack 185164, win 1026, length 0
02:06:50.923036 IP lamp-ubuntu-s-1vcpu-1gb-tor1-01.ssh > bras-base-toroon0817w-grc-26-184-146-121-215.dsl.bell.ca.64650: Flags [P.], seq 191304:191684, ack 109, win 501, length 380
02:06:50.923098 IP lamp-ubuntu-s-1vcpu-1gb-tor1-01.ssh > bras-base-toroon0817w-grc-26-184-146-121-215.dsl.bell.ca.64650: Flags [P.], seq 191684:191904, ack 109, win 501, length 220
02:06:50.923159 IP lamp-ubuntu-s-1vcpu-1gb-tor1-01.ssh > bras-base-toroon0817w-grc-26-184-146-121-215.dsl.bell.ca.64650: Flags [P.], seq 191904:192124, ack 109, win 501, length 220
02:06:50.923221 IP lamp-ubuntu-s-1vcpu-1gb-tor1-01.ssh > bras-base-toroon0817w-grc-26-184-146-121-215.dsl.bell.ca.64650: Flags [P.], seq 192124:192344, ack 109, win 501, length 220
02:06:50.923231 IP bras-base-toroon0817w-grc-26-184-146-121-215.dsl.bell.ca.64650 > lamp-ubuntu-s-1vcpu-1gb-tor1-01.ssh: Flags [.], ack 186424, win 1021, length 0
02:06:50.923281 IP lamp-ubuntu-s-1vcpu-1gb-tor1-01.ssh > bras-base-toroon0817w-grc-26-184-146-121-215.dsl.bell.ca.64650: Flags [P.], seq 192344:192724, ack 109, win 501, length 380
02:06:50.923339 IP lamp-ubuntu-s-1vcpu-1gb-tor1-01.ssh > bras-base-toroon0817w-grc-26-184-146-121-215.dsl.bell.ca.64650: Flags [P.], seq 192724:192944, ack 109, win 501, length 220
02:06:50.923398 IP lamp-ubuntu-s-1vcpu-1gb-tor1-01.ssh > bras-base-toroon0817w-grc-26-184-146-121-215.dsl.bell.ca.64650: Flags [P.], seq 192944:193164, ack 109, win 501, length 220
02:06:50.923458 IP lamp-ubuntu-s-1vcpu-1gb-tor1-01.ssh > bras-base-toroon0817w-grc-26-184-146-121-215.dsl.bell.ca.64650: Flags [P.], seq 193164:193384, ack 109, win 501, length 220
02:06:50.923518 IP lamp-ubuntu-s-1vcpu-1gb-tor1-01.ssh > bras-base-toroon0817w-grc-26-184-146-121-215.dsl.bell.ca.64650: Flags [P.], seq 193384:193604, ack 109, win 501, length 220
02:06:50.923576 IP lamp-ubuntu-s-1vcpu-1gb-tor1-01.ssh > bras-base-toroon0817w-grc-26-184-146-121-215.dsl.bell.ca.64650: Flags [P.], seq 193604:193824, ack 109, win 501, length 220
02:06:50.923634 IP lamp-ubuntu-s-1vcpu-1gb-tor1-01.ssh > bras-base-toroon0817w-grc-26-184-146-121-215.dsl.bell.ca.64650: Flags [P.], seq 193824:194044, ack 109, win 501, length 220
02:06:50.923691 IP lamp-ubuntu-s-1vcpu-1gb-tor1-01.ssh > bras-base-toroon0817w-grc-26-184-146-121-215.dsl.bell.ca.64650: Flags [P.], seq 194044:194264, ack 109, win 501, length 220
02:06:50.923752 IP lamp-ubuntu-s-1vcpu-1gb-tor1-01.ssh > bras-base-toroon0817w-grc-26-184-146-121-215.dsl.bell.ca.64650: Flags [P.], seq 194264:194484, ack 109, win 501, length 220
02:06:50.923762 IP bras-base-toroon0817w-grc-26-184-146-121-215.dsl.bell.ca.64650 > lamp-ubuntu-s-1vcpu-1gb-tor1-01.ssh: Flags [.], ack 187684, win 1026, length 0
02:06:50.923809 IP lamp-ubuntu-s-1vcpu-1gb-tor1-01.ssh > bras-base-toroon0817w-grc-26-184-146-121-215.dsl.bell.ca.64650: Flags [P.], seq 194484:194864, ack 109, win 501, length 380
02:06:50.923872 IP lamp-ubuntu-s-1vcpu-1gb-tor1-01.ssh > bras-base-toroon0817w-grc-26-184-146-121-215.dsl.bell.ca.64650: Flags [P.], seq 194864:195084, ack 109, win 501, length 220
02:06:50.923935 IP lamp-ubuntu-s-1vcpu-1gb-tor1-01.ssh > bras-base-toroon0817w-grc-26-184-146-121-215.dsl.bell.ca.64650: Flags [P.], seq 195084:195304, ack 109, win 501, length 220
02:06:50.923949 IP bras-base-toroon0817w-grc-26-184-146-121-215.dsl.bell.ca.64650 > lamp-ubuntu-s-1vcpu-1gb-tor1-01.ssh: Flags [.], ack 188564, win 1023, length 0
02:06:50.923997 IP lamp-ubuntu-s-1vcpu-1gb-tor1-01.ssh > bras-base-toroon0817w-grc-26-184-146-121-215.dsl.bell.ca.64650: Flags [P.], seq 195304:195684, ack 109, win 501, length 380
02:06:50.924058 IP lamp-ubuntu-s-1vcpu-1gb-tor1-01.ssh > bras-base-toroon0817w-grc-26-184-146-121-215.dsl.bell.ca.64650: Flags [P.], seq 195684:195904, ack 109, win 501, length 220
02:06:50.924117 IP lamp-ubuntu-s-1vcpu-1gb-tor1-01.ssh > bras-base-toroon0817w-grc-26-184-146-121-215.dsl.bell.ca.64650: Flags [P.], seq 195904:196124, ack 109, win 501, length 220
02:06:50.924174 IP lamp-ubuntu-s-1vcpu-1gb-tor1-01.ssh > bras-base-toroon0817w-grc-26-184-146-121-215.dsl.bell.ca.64650: Flags [P.], seq 196124:196344, ack 109, win 501, length 220
02:06:50.924238 IP lamp-ubuntu-s-1vcpu-1gb-tor1-01.ssh > bras-base-toroon0817w-grc-26-184-146-121-215.dsl.bell.ca.64650: Flags [P.], seq 196344:196564, ack 109, win 501, length 220
02:06:50.924249 IP bras-base-toroon0817w-grc-26-184-146-121-215.dsl.bell.ca.64650 > lamp-ubuntu-s-1vcpu-1gb-tor1-01.ssh: Flags [.], ack 189604, win 1026, length 0
02:06:50.924306 IP lamp-ubuntu-s-1vcpu-1gb-tor1-01.ssh > bras-base-toroon0817w-grc-26-184-146-121-215.dsl.bell.ca.64650: Flags [P.], seq 196564:196944, ack 109, win 501, length 380
02:06:50.924369 IP lamp-ubuntu-s-1vcpu-1gb-tor1-01.ssh > bras-base-toroon0817w-grc-26-184-146-121-215.dsl.bell.ca.64650: Flags [P.], seq 196944:197164, ack 109, win 501, length 220
02:06:50.924379 IP bras-base-toroon0817w-grc-26-184-146-121-215.dsl.bell.ca.64650 > lamp-ubuntu-s-1vcpu-1gb-tor1-01.ssh: Flags [.], ack 190424, win 1023, length 0
02:06:50.924425 IP lamp-ubuntu-s-1vcpu-1gb-tor1-01.ssh > bras-base-toroon0817w-grc-26-184-146-121-215.dsl.bell.ca.64650: Flags [P.], seq 197164:197544, ack 109, win 501, length 380
02:06:50.924489 IP lamp-ubuntu-s-1vcpu-1gb-tor1-01.ssh > bras-base-toroon0817w-grc-26-184-146-121-215.dsl.bell.ca.64650: Flags [P.], seq 197544:197764, ack 109, win 501, length 220
02:06:50.924548 IP lamp-ubuntu-s-1vcpu-1gb-tor1-01.ssh > bras-base-toroon0817w-grc-26-184-146-121-215.dsl.bell.ca.64650: Flags [P.], seq 197764:197984, ack 109, win 501, length 220
02:06:50.924612 IP lamp-ubuntu-s-1vcpu-1gb-tor1-01.ssh > bras-base-toroon0817w-grc-26-184-146-121-215.dsl.bell.ca.64650: Flags [P.], seq 197984:198204, ack 109, win 501, length 220
02:06:50.924638 IP bras-base-toroon0817w-grc-26-184-146-121-215.dsl.bell.ca.64650 > lamp-ubuntu-s-1vcpu-1gb-tor1-01.ssh: Flags [.], ack 191304, win 1026, length 0
02:06:50.924686 IP lamp-ubuntu-s-1vcpu-1gb-tor1-01.ssh > bras-base-toroon0817w-grc-26-184-146-121-215.dsl.bell.ca.64650: Flags [P.], seq 198204:198584, ack 109, win 501, length 380
02:06:50.924751 IP lamp-ubuntu-s-1vcpu-1gb-tor1-01.ssh > bras-base-toroon0817w-grc-26-184-146-121-215.dsl.bell.ca.64650: Flags [P.], seq 198584:198804, ack 109, win 501, length 220
02:06:50.924814 IP lamp-ubuntu-s-1vcpu-1gb-tor1-01.ssh > bras-base-toroon0817w-grc-26-184-146-121-215.dsl.bell.ca.64650: Flags [P.], seq 198804:199024, ack 109, win 501, length 220
02:06:50.924827 IP bras-base-toroon0817w-grc-26-184-146-121-215.dsl.bell.ca.64650 > lamp-ubuntu-s-1vcpu-1gb-tor1-01.ssh: Flags [.], ack 192724, win 1021, length 0
02:06:50.924871 IP lamp-ubuntu-s-1vcpu-1gb-tor1-01.ssh > bras-base-toroon0817w-grc-26-184-146-121-215.dsl.bell.ca.64650: Flags [P.], seq 199024:199404, ack 109, win 501, length 380
02:06:50.924933 IP lamp-ubuntu-s-1vcpu-1gb-tor1-01.ssh > bras-base-toroon0817w-grc-26-184-146-121-215.dsl.bell.ca.64650: Flags [P.], seq 199404:199624, ack 109, win 501, length 220
02:06:50.924999 IP lamp-ubuntu-s-1vcpu-1gb-tor1-01.ssh > bras-base-toroon0817w-grc-26-184-146-121-215.dsl.bell.ca.64650: Flags [P.], seq 199624:199844, ack 109, win 501, length 220
02:06:50.925062 IP lamp-ubuntu-s-1vcpu-1gb-tor1-01.ssh > bras-base-toroon0817w-grc-26-184-146-121-215.dsl.bell.ca.64650: Flags [P.], seq 199844:200064, ack 109, win 501, length 220
02:06:50.925127 IP lamp-ubuntu-s-1vcpu-1gb-tor1-01.ssh > bras-base-toroon0817w-grc-26-184-146-121-215.dsl.bell.ca.64650: Flags [P.], seq 200064:200284, ack 109, win 501, length 220
02:06:50.925192 IP lamp-ubuntu-s-1vcpu-1gb-tor1-01.ssh > bras-base-toroon0817w-grc-26-184-146-121-215.dsl.bell.ca.64650: Flags [P.], seq 200284:200504, ack 109, win 501, length 220
02:06:50.925202 IP bras-base-toroon0817w-grc-26-184-146-121-215.dsl.bell.ca.64650 > lamp-ubuntu-s-1vcpu-1gb-tor1-01.ssh: Flags [.], ack 193824, win 1026, length 0
02:06:50.925251 IP lamp-ubuntu-s-1vcpu-1gb-tor1-01.ssh > bras-base-toroon0817w-grc-26-184-146-121-215.dsl.bell.ca.64650: Flags [P.], seq 200504:200884, ack 109, win 501, length 380
02:06:50.925304 IP lamp-ubuntu-s-1vcpu-1gb-tor1-01.ssh > bras-base-toroon0817w-grc-26-184-146-121-215.dsl.bell.ca.64650: Flags [P.], seq 200884:201104, ack 109, win 501, length 220
02:06:50.925367 IP lamp-ubuntu-s-1vcpu-1gb-tor1-01.ssh > bras-base-toroon0817w-grc-26-184-146-121-215.dsl.bell.ca.64650: Flags [P.], seq 201104:201324, ack 109, win 501, length 220
02:06:50.925377 IP bras-base-toroon0817w-grc-26-184-146-121-215.dsl.bell.ca.64650 > lamp-ubuntu-s-1vcpu-1gb-tor1-01.ssh: Flags [.], ack 194864, win 1022, length 0
02:06:50.925425 IP lamp-ubuntu-s-1vcpu-1gb-tor1-01.ssh > bras-base-toroon0817w-grc-26-184-146-121-215.dsl.bell.ca.64650: Flags [P.], seq 201324:201704, ack 109, win 501, length 380
02:06:50.925485 IP lamp-ubuntu-s-1vcpu-1gb-tor1-01.ssh > bras-base-toroon0817w-grc-26-184-146-121-215.dsl.bell.ca.64650: Flags [P.], seq 201704:201924, ack 109, win 501, length 220
02:06:50.925536 IP lamp-ubuntu-s-1vcpu-1gb-tor1-01.ssh > bras-base-toroon0817w-grc-26-184-146-121-215.dsl.bell.ca.64650: Flags [P.], seq 201924:202144, ack 109, win 501, length 220
02:06:50.925586 IP lamp-ubuntu-s-1vcpu-1gb-tor1-01.ssh > bras-base-toroon0817w-grc-26-184-146-121-215.dsl.bell.ca.64650: Flags [P.], seq 202144:202364, ack 109, win 501, length 220
02:06:50.925637 IP lamp-ubuntu-s-1vcpu-1gb-tor1-01.ssh > bras-base-toroon0817w-grc-26-184-146-121-215.dsl.bell.ca.64650: Flags [P.], seq 202364:202584, ack 109, win 501, length 220
02:06:50.925688 IP lamp-ubuntu-s-1vcpu-1gb-tor1-01.ssh > bras-base-toroon0817w-grc-26-184-146-121-215.dsl.bell.ca.64650: Flags [P.], seq 202584:202804, ack 109, win 501, length 220
02:06:50.925697 IP bras-base-toroon0817w-grc-26-184-146-121-215.dsl.bell.ca.64650 > lamp-ubuntu-s-1vcpu-1gb-tor1-01.ssh: Flags [.], ack 196124, win 1026, length 0
02:06:50.925745 IP lamp-ubuntu-s-1vcpu-1gb-tor1-01.ssh > bras-base-toroon0817w-grc-26-184-146-121-215.dsl.bell.ca.64650: Flags [P.], seq 202804:203184, ack 109, win 501, length 380
02:06:50.925805 IP lamp-ubuntu-s-1vcpu-1gb-tor1-01.ssh > bras-base-toroon0817w-grc-26-184-146-121-215.dsl.bell.ca.64650: Flags [P.], seq 203184:203404, ack 109, win 501, length 220
02:06:50.925858 IP lamp-ubuntu-s-1vcpu-1gb-tor1-01.ssh > bras-base-toroon0817w-grc-26-184-146-121-215.dsl.bell.ca.64650: Flags [P.], seq 203404:203624, ack 109, win 501, length 220
02:06:50.925909 IP lamp-ubuntu-s-1vcpu-1gb-tor1-01.ssh > bras-base-toroon0817w-grc-26-184-146-121-215.dsl.bell.ca.64650: Flags [P.], seq 203624:203844, ack 109, win 501, length 220
02:06:50.925960 IP lamp-ubuntu-s-1vcpu-1gb-tor1-01.ssh > bras-base-toroon0817w-grc-26-184-146-121-215.dsl.bell.ca.64650: Flags [P.], seq 203844:204064, ack 109, win 501, length 220
02:06:50.926010 IP lamp-ubuntu-s-1vcpu-1gb-tor1-01.ssh > bras-base-toroon0817w-grc-26-184-146-121-215.dsl.bell.ca.64650: Flags [P.], seq 204064:204284, ack 109, win 501, length 220
02:06:50.926064 IP lamp-ubuntu-s-1vcpu-1gb-tor1-01.ssh > bras-base-toroon0817w-grc-26-184-146-121-215.dsl.bell.ca.64650: Flags [P.], seq 204284:204504, ack 109, win 501, length 220
02:06:50.926074 IP bras-base-toroon0817w-grc-26-184-146-121-215.dsl.bell.ca.64650 > lamp-ubuntu-s-1vcpu-1gb-tor1-01.ssh: Flags [.], ack 197164, win 1022, length 0
02:06:50.926126 IP lamp-ubuntu-s-1vcpu-1gb-tor1-01.ssh > bras-base-toroon0817w-grc-26-184-146-121-215.dsl.bell.ca.64650: Flags [P.], seq 204504:204884, ack 109, win 501, length 380
02:06:50.926178 IP lamp-ubuntu-s-1vcpu-1gb-tor1-01.ssh > bras-base-toroon0817w-grc-26-184-146-121-215.dsl.bell.ca.64650: Flags [P.], seq 204884:205104, ack 109, win 501, length 220
02:06:50.926231 IP bras-base-toroon0817w-grc-26-184-146-121-215.dsl.bell.ca.64650 > lamp-ubuntu-s-1vcpu-1gb-tor1-01.ssh: Flags [.], ack 198204, win 1026, length 0
02:06:50.926238 IP lamp-ubuntu-s-1vcpu-1gb-tor1-01.ssh > bras-base-toroon0817w-grc-26-184-146-121-215.dsl.bell.ca.64650: Flags [P.], seq 205104:205324, ack 109, win 501, length 220
02:06:50.926312 IP lamp-ubuntu-s-1vcpu-1gb-tor1-01.ssh > bras-base-toroon0817w-grc-26-184-146-121-215.dsl.bell.ca.64650: Flags [P.], seq 205324:205704, ack 109, win 501, length 380
02:06:50.926323 IP bras-base-toroon0817w-grc-26-184-146-121-215.dsl.bell.ca.64650 > lamp-ubuntu-s-1vcpu-1gb-tor1-01.ssh: Flags [.], ack 199624, win 1021, length 0
02:06:50.926373 IP lamp-ubuntu-s-1vcpu-1gb-tor1-01.ssh > bras-base-toroon0817w-grc-26-184-146-121-215.dsl.bell.ca.64650: Flags [P.], seq 205704:206084, ack 109, win 501, length 380
02:06:50.926425 IP lamp-ubuntu-s-1vcpu-1gb-tor1-01.ssh > bras-base-toroon0817w-grc-26-184-146-121-215.dsl.bell.ca.64650: Flags [P.], seq 206084:206304, ack 109, win 501, length 220
02:06:50.926476 IP lamp-ubuntu-s-1vcpu-1gb-tor1-01.ssh > bras-base-toroon0817w-grc-26-184-146-121-215.dsl.bell.ca.64650: Flags [P.], seq 206304:206524, ack 109, win 501, length 220
02:06:50.926527 IP lamp-ubuntu-s-1vcpu-1gb-tor1-01.ssh > bras-base-toroon0817w-grc-26-184-146-121-215.dsl.bell.ca.64650: Flags [P.], seq 206524:206744, ack 109, win 501, length 220
02:06:50.926578 IP lamp-ubuntu-s-1vcpu-1gb-tor1-01.ssh > bras-base-toroon0817w-grc-26-184-146-121-215.dsl.bell.ca.64650: Flags [P.], seq 206744:206964, ack 109, win 501, length 220
02:06:50.926628 IP lamp-ubuntu-s-1vcpu-1gb-tor1-01.ssh > bras-base-toroon0817w-grc-26-184-146-121-215.dsl.bell.ca.64650: Flags [P.], seq 206964:207184, ack 109, win 501, length 220
02:06:50.926681 IP lamp-ubuntu-s-1vcpu-1gb-tor1-01.ssh > bras-base-toroon0817w-grc-26-184-146-121-215.dsl.bell.ca.64650: Flags [P.], seq 207184:207404, ack 109, win 501, length 220
02:06:50.926733 IP bras-base-toroon0817w-grc-26-184-146-121-215.dsl.bell.ca.64650 > lamp-ubuntu-s-1vcpu-1gb-tor1-01.ssh: Flags [.], ack 200504, win 1026, length 0
02:06:50.926740 IP lamp-ubuntu-s-1vcpu-1gb-tor1-01.ssh > bras-base-toroon0817w-grc-26-184-146-121-215.dsl.bell.ca.64650: Flags [P.], seq 207404:207624, ack 109, win 501, length 220
02:06:50.926795 IP lamp-ubuntu-s-1vcpu-1gb-tor1-01.ssh > bras-base-toroon0817w-grc-26-184-146-121-215.dsl.bell.ca.64650: Flags [P.], seq 207624:208004, ack 109, win 501, length 380
02:06:50.926845 IP lamp-ubuntu-s-1vcpu-1gb-tor1-01.ssh > bras-base-toroon0817w-grc-26-184-146-121-215.dsl.bell.ca.64650: Flags [P.], seq 208004:208224, ack 109, win 501, length 220
02:06:50.926895 IP lamp-ubuntu-s-1vcpu-1gb-tor1-01.ssh > bras-base-toroon0817w-grc-26-184-146-121-215.dsl.bell.ca.64650: Flags [P.], seq 208224:208444, ack 109, win 501, length 220
02:06:50.926944 IP lamp-ubuntu-s-1vcpu-1gb-tor1-01.ssh > bras-base-toroon0817w-grc-26-184-146-121-215.dsl.bell.ca.64650: Flags [P.], seq 208444:208664, ack 109, win 501, length 220
02:06:50.926994 IP lamp-ubuntu-s-1vcpu-1gb-tor1-01.ssh > bras-base-toroon0817w-grc-26-184-146-121-215.dsl.bell.ca.64650: Flags [P.], seq 208664:208884, ack 109, win 501, length 220
02:06:50.927044 IP lamp-ubuntu-s-1vcpu-1gb-tor1-01.ssh > bras-base-toroon0817w-grc-26-184-146-121-215.dsl.bell.ca.64650: Flags [P.], seq 208884:209104, ack 109, win 501, length 220
02:06:50.927095 IP bras-base-toroon0817w-grc-26-184-146-121-215.dsl.bell.ca.64650 > lamp-ubuntu-s-1vcpu-1gb-tor1-01.ssh: Flags [.], ack 201324, win 1023, length 0
02:06:50.927101 IP lamp-ubuntu-s-1vcpu-1gb-tor1-01.ssh > bras-base-toroon0817w-grc-26-184-146-121-215.dsl.bell.ca.64650: Flags [P.], seq 209104:209324, ack 109, win 501, length 220
02:06:50.927157 IP lamp-ubuntu-s-1vcpu-1gb-tor1-01.ssh > bras-base-toroon0817w-grc-26-184-146-121-215.dsl.bell.ca.64650: Flags [P.], seq 209324:209704, ack 109, win 501, length 380
02:06:50.927208 IP lamp-ubuntu-s-1vcpu-1gb-tor1-01.ssh > bras-base-toroon0817w-grc-26-184-146-121-215.dsl.bell.ca.64650: Flags [P.], seq 209704:209924, ack 109, win 501, length 220
02:06:50.927258 IP lamp-ubuntu-s-1vcpu-1gb-tor1-01.ssh > bras-base-toroon0817w-grc-26-184-146-121-215.dsl.bell.ca.64650: Flags [P.], seq 209924:210144, ack 109, win 501, length 220
02:06:50.927309 IP lamp-ubuntu-s-1vcpu-1gb-tor1-01.ssh > bras-base-toroon0817w-grc-26-184-146-121-215.dsl.bell.ca.64650: Flags [P.], seq 210144:210364, ack 109, win 501, length 220
